{
  "doc_id": "cmp-run-001",
  "source_type": "invoice",
  "locale": "en-US",
  "required_profile": "invoice_strict",
  "extracted_fields": {
    "vendor_name": "Run Vendor",
    "invoice_number": "RUN-VAL-001",
    "invoice_date": "2026-02-28",
    "due_date": "2026-03-30",
    "currency": "USD",
    "subtotal": 1200.0,
    "tax_total": 120.0,
    "grand_total": 1320.0
  },
  "is_complete": true,
  "missing_fields": [],
  "warning_codes": [],
  "status_code": "COMPLETE"
}
